{"bindings":{"code_git_blobs":{".gitattributes":"07191d1663193f75605fad6b6f0f9b90f24b9160","docs/individuation/PRESEAL_CANDIDATE_03G.json":"0a888ae5ebd8523f37677840ea58c75cdc91a133","docs/individuation/TURNOVER_AUTHORIZATION_TEMPLATE_03G.json":"50c215877969108861bed6ab4064da672b307c31","docs/individuation/TURNOVER_CANONICAL_INDEX_03G.json":"445a77662ee1a768297031f37e3eb16f4e371c1f","docs/individuation/TURNOVER_DECISION_TREE_03G.json":"1c6a177c6b78bbaeb467575900351dc01e771b59","docs/individuation/TURNOVER_ENVIRONMENT_03G.md":"c9f04cef2f27655a7d5bd761531f7ceba6df33ff","docs/individuation/TURNOVER_ENVIRONMENT_LOCK_03G.txt":"3f04127d6895b6a1a2583a416e2be01856b562d8","docs/individuation/TURNOVER_PROTOCOL_03G.md":"2f091123adc9d0c4b089ca3dd2559f5487248c28","docs/individuation/TURNOVER_RAW_SCHEMA_03G.json":"c712082de726e09decfbe0bddbe4d384888ae883","docs/individuation/TURNOVER_SEED_MANIFEST_03G.md":"a9b2171bf7eaba6d08bff52f0fd9207952c9fe70","edlab/experiments/sc_iom/engine.py":"497e233345d03312c740a57d10d4aaa89e603fd2","edlab/experiments/sc_mcm/config.py":"573a2d9f7202a0ab1e3a3c7984e8645142f20956","edlab/experiments/sc_mcm/engine.py":"2a2aaf47b65eb1dd0ecb6b1189c64fcda7eff0e2","edlab/substrates/scaffold/engine.py":"7c91b9112ab3dde57621251a159d3c1368ad2311","edlab/substrates/scaffold/observables.py":"196539e07b9b62d11b47a6310c3fdaa1a0308223","experiments/individuation/bijective_tracker.py":"089d00bd62866e49756e6d5fc117f06eeec7d3c7","experiments/individuation/causal_confirm.py":"aeb80a235844452948a08a6db3cfa04046dd1fa2","experiments/individuation/material_tracer.py":"cf72a13efd78ceb7e6d1d61291b2d3b930b4e0dd","experiments/individuation/nonmerging_confirm.py":"b3af9dbfdaf1b0150006c4822976f9f0b1a51d97","experiments/individuation/test_bijective_tracker.py":"710336e11875af570c3d32a29e844781aecbf8e1","experiments/individuation/test_turnover_end_to_end_03g.py":"dd0341fa335134095a4f3fddce9412e6a955d9a0","experiments/individuation/test_turnover_preseal_03c.py":"97920c46ee188ccfdcef8726fb23cd18a4956dc9","experiments/individuation/test_turnover_preseal_03e.py":"6be511302df931600456bdb03fa83032e8bad036","experiments/individuation/test_turnover_tracer.py":"9ba680221acfc77248fffdc94e0f74cb11852556","experiments/individuation/turnover_analyzer_03g.py":"018abf60688658f8ca6c5651995c0c372202adcf","experiments/individuation/turnover_dev_runner.py":"40169bf8d7075acfdd821457a77eba5b38893fa8","experiments/individuation/turnover_engine_03g.py":"40e700ac39b938fd766e78c5da6f33b5f78ea900","experiments/individuation/turnover_event_evidence.py":"35ef8e0cfe9bd530b888d1a290fa5e0750c0948b","experiments/individuation/turnover_ledger_03g.py":"7496f9871f1eeda957d2b50782c9396718d1fdb6","experiments/individuation/turnover_power_regen.py":"703550fa78ba78225418a9ab7ec2be50648f13c8","experiments/individuation/turnover_raw_schema_03g.py":"90631d24d783e20f74bbc9bd6d8d034e77f7bebc","experiments/individuation/turnover_runner_03g.py":"6444fcf8d702da9018472a630f7b8bd86a6d55d1","experiments/individuation/turnover_scope_features.py":"d36ac3622a6939bc321ac3d3bb3a63b71a9e513b","experiments/individuation/turnover_scope_features_03e.py":"34f1cc4d48804876aecee0a1f13ddeee01118df2","experiments/individuation/turnover_scope_features_03g.py":"6734e90cdc7344bf8f6dd77b6213dd8bb220adae","experiments/individuation/turnover_statistics.py":"c4890ab06b38de4d6c20e73e31b20e4574c3b05d","experiments/individuation/turnover_statistics_03g.py":"6d52d4cca801a4a2eb06be169c647ff6ec854437"},"code_sha256":{".gitattributes":"5489402203553800f188b27026b9ce3737e3cfd9781f6067607f624d3913646b","docs/individuation/PRESEAL_CANDIDATE_03G.json":"bd31d5e933af75abe1010886fb913379b4e37623c51f1ec7033519fed8625fdb","docs/individuation/TURNOVER_AUTHORIZATION_TEMPLATE_03G.json":"51c571f5686a0dc4d11636a1d7ae848ffa17a2449847742c37f93480a8b136c2","docs/individuation/TURNOVER_CANONICAL_INDEX_03G.json":"f84a18fce89b1240b1b3391d361d3c2122ca191115246ce9332629aae6f97475","docs/individuation/TURNOVER_DECISION_TREE_03G.json":"44a9ec2b3d359f0aed7048c8857df5cc93410466dcacaa21ba772e54c753c4e1","docs/individuation/TURNOVER_ENVIRONMENT_03G.md":"cefd1ea7e0098ba03250415841ac4c059b3e01d65831c5d0a71a6b8943e3070a","docs/individuation/TURNOVER_ENVIRONMENT_LOCK_03G.txt":"bdffda614e9fb1062d301a6c25b13737362f54c621a90c6d8d1f52c2271f4f4f","docs/individuation/TURNOVER_PROTOCOL_03G.md":"77cc6e11b29b11f3510acb0ae87fd6c2e2cd7a7d41bcf4cc66c908ccefa3dda8","docs/individuation/TURNOVER_RAW_SCHEMA_03G.json":"8b08caeb6fef7cc811c36714477b1702d6376dc46c33370988a45e9cceb56a2b","docs/individuation/TURNOVER_SEED_MANIFEST_03G.md":"58600974bf9b35b901249113a987559ba35c6bad3260631038b3cb1420c4576e","edlab/experiments/sc_iom/engine.py":"fa07b5e2a1c111cde41ddc8d1254f63a3097751e2d432013ae24ab38b1ceb54f","edlab/experiments/sc_mcm/config.py":"71a112623f3b7593b3c32c344f3b05418cf6eab965ae1f3a5c0354feb2b27c76","edlab/experiments/sc_mcm/engine.py":"d51a5db1848e717a44f9e00aa4ad4b9c86465ec245184b78b2516dad9842ef2d","edlab/substrates/scaffold/engine.py":"dee42f1879c9a42ec52833406cc3d89e859c154157eab34c1f570919b93b1df5","edlab/substrates/scaffold/observables.py":"de78e3f9835b15bec3ba252bd9b51a1152e820897aca133d1cf3bbe17e7b756c","experiments/individuation/bijective_tracker.py":"c799c17f1af4556e0cc66eb2305f8e4b1846beeb5cf4c4ae0648d2ab6b76ca4b","experiments/individuation/causal_confirm.py":"134dc3550f8f36dcb762d799a2bb6d3a0f60a75cf1bce2e91ed19b8d9a5ecdad","experiments/individuation/material_tracer.py":"32b73f7769e36ff4fa69d62f63bc9a5afa0bd0ad2ff86bb0822b042725aa9815","experiments/individuation/nonmerging_confirm.py":"9ca619eaed2b5b560acaed06fe2cee8b9339d2299d0d1320d79a0cd897510655","experiments/individuation/test_bijective_tracker.py":"e08f3173c84123d9b7d76e45a18f2d612d9ebfd430ba2bfbec37fa44f9eee0a9","experiments/individuation/test_turnover_end_to_end_03g.py":"88fb4f3b3491e5579a49ac444216cd35ee823f3e6088363ada918689181bc4a7","experiments/individuation/test_turnover_preseal_03c.py":"c7e44ade997f59274b391a570e2506787daea20131172a09b9bbef33dc33b562","experiments/individuation/test_turnover_preseal_03e.py":"9097e38ccd6c181b983580130c65dcc7fbb2f43ff274fcea24630de0a99319a7","experiments/individuation/test_turnover_tracer.py":"c82ca315757f7b63ec3cdd3a653a9aa50f8eb2b5f75dc9b12beef916c284052a","experiments/individuation/turnover_analyzer_03g.py":"ff95b55dfb5eed52542cdc8eff2b58aa923dbaca92c148091ff54b14336e1b0e","experiments/individuation/turnover_dev_runner.py":"899484224bf86d9c377347b8bb5e166a8fab9a617e5bc7299a369436ca3d5d72","experiments/individuation/turnover_engine_03g.py":"7a7736d2c95b08e073327bfa6984cefa6d8055da49943ced887567ae6cddc8f9","experiments/individuation/turnover_event_evidence.py":"e8dc2f2b1d5199d2583d4fce3338e40fd6edf405e4a8749da2a44743925c6bad","experiments/individuation/turnover_ledger_03g.py":"91b9f3e9bfff3840f4e2c7034e155134618c324b0d87f4a0c6022efb8e802eab","experiments/individuation/turnover_power_regen.py":"c727586c5bb9c30ce6057478601fd83017ee3608942cc25eb1d3715aedffc6a4","experiments/individuation/turnover_raw_schema_03g.py":"59e4b50f05a6f96f99f444dfeae41726961c5d00c8d87ba9098cf77a94b97fb7","experiments/individuation/turnover_runner_03g.py":"48098f660221d2c5e7dfa5b7d3c31b6847d11c2876f303c6fdd54f04ccccaba3","experiments/individuation/turnover_scope_features.py":"3b485d4fd7d3a6d093ed6bd256314caf955b8991645c4631925def1a2cdcc1f5","experiments/individuation/turnover_scope_features_03e.py":"b559910490f92fc756ed5fc375416f3d520c8f5a07bdcdd573d0c343af134535","experiments/individuation/turnover_scope_features_03g.py":"7bcd05c52094aca6dbd27282b53e93a381e044b7a3229e6e1972fe8ad55d6742","experiments/individuation/turnover_statistics.py":"fd8264e7b3d181bd4c8098ddd2c7f273f5c8fda40d93dabca1172e598f2eb22d","experiments/individuation/turnover_statistics_03g.py":"c99a0eb1d62d9469b1fbf2ec7373f79a950e839925ce456a50935c2551fcf1e0"},"environment_lock_sha256":"bdffda614e9fb1062d301a6c25b13737362f54c621a90c6d8d1f52c2271f4f4f","execution_manifest_git_blob":"c425b6b330b9c775567886c58a167e334ff9562f","execution_manifest_sha256":"edfb4847a6dbf44fedf000be9f745a50fc1dcb18e0b7b6cb14f4dfa077183bc2","seal_sha256":"cdf7277a00e3017a1389e9334d983364b9aa0af88c646cdec2999e6ad88757fd"},"feasibility":{"deep_assay_valid":false,"deep_reached":false,"eligible":false,"reason":"fewer_than_three_geometrically_eligible_targets","rest_assay_valid":false,"valid":false},"mode":"PROSPECTIVE","schema":"LCI-TURNOVER-RAW-03G-v1","scientific":{"causal_intervention_battery":{"deep":null,"rest":null},"censoring_reason":"fewer_than_three_geometrically_eligible_targets","g0":{"deep_valid":false,"rest_valid":false},"histories":{"order_secondary":[],"own_dose":[],"phase_amplitudes":[],"primary_coordinate":"own cumulative dose / m-plus"},"lambda_plus_only_control":{"deep":null,"lam_minus":0.15,"lam_plus":0.0,"rest":null},"material_tracer":{"deep_M":null,"tracer_base":null,"trajectory":[]},"scopes":null,"snapshot_time":null,"target_centroids":[],"target_ids":[],"tracking_event_evidence":[]},"seed":54030,"watermark":"PROSPECTIVE - SCIENTIFIC INTERPRETATION ONLY AFTER VALID SEAL, HUMAN AUTHORIZATION, AND CERTIFIED EXECUTION","world_id":54030}
